IS_ANNOTATION,LinguisticExamples
CONTAINMENT,Those are the main points I’ll be talking about. Now I’ll flesh them out for you.
CONTAINMENT,The wildfire of revolution rapidly spread throughout the land.
CONTAINMENT,Why don’t you join in and have some fun?
CONTAINMENT,The police were called in to investigate the robbery.
CONTAINMENT,The company has decided to pull out of the project.
CONTAINMENT,He didn’t want to look as if he was chickening out.
CONTAINMENT,A deal is a deal. You can’t back out now.
CONTAINMENT,Such behavior might result in the executive being asked to leave.
CONTAINMENT,He believes in individual liberty.
CONTAINMENT,This room will be changed into a kitchen.
CONTAINMENT,I talked him into accepting the job.
CONTAINMENT,The lamp gives out dim lights.
CONTAINMENT,The bells rang out.
CONTAINMENT,Each of the eggs hatches out into a tiny grub.
CONTAINMENT,I don’t go in for that sort of fishing.
CONTAINMENT,Frank told himself not to be taken in by superficial appearances.
CONTAINMENT,"I don’t like the book when I started it, but the strange story soon draw me in."
CONTAINMENT,I had no idea what I was going to write about when I started out.
CONTAINMENT,They succeeded in what they had set out to do.
CONTAINMENT,The woods have burnt out.
CONTAINMENT,I spent three days cleaning our flat out.
CONTAINMENT,Comprehensive schools assisted in flattening out all regional accents.
CONTAINMENT,Increased productivity and generous staffing could be said to cancel each other out.
CONTAINMENT,I thought most of the problems were ironed out.
CONTAINMENT,The lights went out.
CONTAINMENT,We turned out the lights.
CONTAINMENT,They put/beat out the fire.
CONTAINMENT,Someone opened the door and the candle blew out.
CONTAINMENT,The proposals were hedged in with legal niceties.
CONTAINMENT,You have to contract in if you want to participate in the scheme.
CONTAINMENT,He felt hemmed in by convention.
CONTAINMENT,He cannot hold in his anger.
CONTAINMENT,The war broke out.
CONTAINMENT,He burst out laughing.
CONTAINMENT,Thicker fabrics and darker colors came in.
CONTAINMENT,Labor governments come in promising to expand public expenditure.
CONTAINMENT,All the facts came out after Sherry’s death.
CONTAINMENT,His new book will come out next month.
CONTAINMENT,She became trapped as the tide came in.
CONTAINMENT,The tide has gone out.
CONTAINMENT,The cold weather set in.
CONTAINMENT,The use of the lead-free petrol is now being phased in.
CONTAINMENT,"After the introduction, we’ll fade in the first scene."
CONTAINMENT,Traditional grocer’s shops are fast dying out.
CONTAINMENT,The sound of the chopper has faded out.
CONTAINMENT,He has been hiding out in a provincial village.
CONTAINMENT,Mask out his voice with white noise.
CONTAINMENT,The noise from the plane drowned out the noise of the gun.
CONTAINMENT,My head thumped solidly on a rock and I passed out.
CONTAINMENT,The tablet knocked her out for four solid hours.
CONTAINMENT,"The plane dived suddenly, causing the pilot to black out."
CONTAINMENT,The information has been leaked out.
CONTAINMENT,The singer has brought out a second album.
CONTAINMENT,They managed to work out a solution to the problem.
CONTAINMENT,She was able to reason out many of the passages and their meanings.
CONTAINMENT,They need to interview some people and find out whether they like their jobs.
CONTAINMENT,"The river sliced through sediments, carving out the gorge."
CONTAINMENT,The first experiments were carried out by Dr. Preston.
CONTAINMENT,The factory turns out 5000 cars every month.
CONTAINMENT,The president promised to look into the matter.
CONTAINMENT,When he got back to Berlin he would inquire into the whole business.
CONTAINMENT,...trapping so many people in state dependency robs them of their human dignity.
CONTAINMENT,[T]he federal government's welfare assistance programs intended to help those in need instead effectively trap people into dependence
CONTAINMENT,We pitched them the idea and they ate it right up.
CONTAINMENT,He's been feeding her lies all these years.
CONTAINMENT,This article is hard to digest.
CONTAINMENT,I've been feeding him stock market tips for weeks.
CONTAINMENT,This SUV sure is a gas guzzler.
CONTAINMENT,Demand for paper goods is eating away at our planet's forests.
CONTAINMENT,Developing nations are gobbling up our fossil fuels at any alarming rate.
CONTAINMENT,The United States' insatiable appetite for electronics will entirely consume our supply of rare metals.
CONTAINMENT,We have not found a way to stem this rising flood of gun violence.
CONTAINMENT,We are drowning in an ocean of gun violence.
CONTAINMENT,Lost in the bureaucratic maze of city's criminal justice system
CONTAINMENT,We need to protect our rights from infringement.
CONTAINMENT,The government overstepped a line when they proposed wiretapping citizens' phone lines.
CONTAINMENT,Gay marriage is encroaching on our religious freedoms.
CONTAINMENT,These gay marriage laws have invaded our religious rights.
CONTAINMENT,The government needs to stay out of my bedroom.
CONTAINMENT,"The poor deserve a hand up, not a handout."
CONTAINMENT,"The government shouldn't just give handouts, it needs to encourage people to get jobs instead."
CONTAINMENT,We covered a lot of ground.
CONTAINMENT,He’s on our trail.
CONTAINMENT,He strayed off the trail.
CONTAINMENT,We went back over the same trail.
CONTAINMENT,We have already covered those points.
CONTAINMENT,We have covered a lot of ground in our argument.
CONTAINMENT,Let’s go back over the argument again.
CONTAINMENT,You’re getting off the subject.
CONTAINMENT,You’re really onto something there.
CONTAINMENT,We’re well on our way to solving this problem.
CONTAINMENT,The theory was expanded to cover more data.
CONTAINMENT,That theory covers a lot of territory.
CONTAINMENT,The theory filled in gaps left in earlier accounts.
CONTAINMENT,The theory fit the data closely.
CONTAINMENT,The theory doesn’t fit with the facts.
CONTAINMENT,There was a hole in theory (it fails to cover all the facts)
CONTAINMENT,The theory is closely tied to the facts.
CONTAINMENT,The crisis stripped away our veneer of sophistication.
CONTAINMENT,We donned an appearance of nonchallance.
CONTAINMENT,Put on a happy face.
CONTAINMENT,Under cover of darkness.
CONTAINMENT,He was enveloped in darkness.
CONTAINMENT,Darkness closed in over us.
CONTAINMENT,It's what's on the inside that counts.
CONTAINMENT,She only has surface charm.
CONTAINMENT,"We’ve been in a close relationship for years, but it’s beginning to seem confining."
CONTAINMENT,to have an open marriage
CONTAINMENT,She's trapped in a relationship with a scumbag.
CONTAINMENT,They had a falling out.
COVERING,Government transparency enables the public to hold the government accountable for how they spend their money.
COVERING,Beijing has encouraged regional authorities to introduce sunshine policies that tackle corruption through increased transparency.
COVERING,His judgement is clouded.
COVERING,The US is blind to the limits of Palestinian politics.
COVERING,The issue was exposed to the light of day.
COVERING,The government covered up the high levels of radiation.
COVERING,Ecologists Shed New Light On Effects of Light Pollution On Wildlife
FORCE,Apply more force to the edge of the lid.
FORCE,Direct more force at the hinges.
FORCE,Focus force on the weak spots.
FORCE,It took a lot of force to open it.
FORCE,Use more force in driving the nail.
FORCE,Exert more force on the lock.
FORCE,Put more force behind your punches.
FORCE,Back up your punches with more force.
FORCE,Put more force into your punches.
FORCE,Put more force into your punches.
FORCE,His punches carry a lot of force.
FORCE,Each sentence contained the force of an order.
FORCE,His punches have a lot of force.
FORCE,His punches have a lot of force.
FORCE,Her death hit us with a lot of force.
FORCE,The force of the blow knocked me over.
FORCE,The force added to the swing was enough to send the ball over the fence.
FORCE,The trial thrust O.J.'s attorney's into the limelight.
FORCE,FDR's leadership brought the country out of the depression.
FORCE,That experience pushed him over the edge
FORCE,and she sat up to meet its thrusts
FORCE,you’re always so battered by the world outside.
FORCE,"as if in dread of being attacked, restless and keen"
FORCE,and then been violently shattered with the greatest shock and pain by her fickle- ness and frivolities.
FORCE,"A shaft of pain cut through the nebulous pattern,/ of blows and humiliations not yet dissolved"
FORCE,Some shock shattered you and made you distrustful of a single love.
FORCE,his extended love was unequal to the power of what was dragging her down
FORCE,about to be sucked in by a hidden cyclone.
FORCE,That coat pulled me into the store.
FORCE,The smell of the cookies dragged me against my will to the cookie jar.
FORCE,I was drawn to him.
FORCE,They are attracted to each other.
FORCE,"it does pull me in, it pulls me back in at certain points, and when I’m pulled in I can’t really pay as much attention to what’s happening."
FORCE,"It drew me in again further, fascinated."
FORCE,I was so wrapped up in the movie I forgot to pause on the man itself.
FORCE,and I get caught up in it.
FORCE,it’s very gripping.
FORCE,that captured me in a way that some movies don’t. [22] it kind of sucks you in.
FORCE,and that kind of further ties me in.
FORCE,"being really, really hooked into the story."
FORCE,He is unbalanced.
FORCE,She’s not on an even keel.
FORCE,They’re upset.
FORCE,I’m a very stable individual.
FORCE,She’s quite level-headed
FORCE,You have to weigh the pros and cons.
FORCE,The scale just tipped in favor of my voting yes.
FORCE,On the other hand. . .
FORCE,That's a lightweight issue.
FORCE,This is a substantial problem for us.
FORCE,"Before we draw any conclusions, we must weigh both sides of the issue."
FORCE,He weighed the ideas in his mind.
FORCE,You have to weigh up in your mind whether to pursue the matter or not.
FORCE,You have to weigh the costs of the new system against the benefit it will bring.
FORCE,"Before we draw any conclusions, we must weigh both sides of the issue."
FORCE,Let’s try to get around this problem.
FORCE,Harry got over his divorce.
FORCE,She’s trying to get around the regulations.
FORCE,He went through the trial.
FORCE,We ran into a brick wall.
FORCE,We’ve got him boxed into a corner.
FORCE,We hit a roadblock.
FORCE,We are at an impasse.
FORCE,I can't find my way around that.
FORCE,Debt is holding me back from reaching my goals.
FORCE,"The way of the lazy is overgrown with thorns, but the path of the upright is a level highway."
FORCE,"Thorns and snares are in the way of the perverse, the cautious will keep far from them."
FORCE,fear barrier
FORCE,barrier of fear
FORCE,fear is an obstacle
FORCE,fear blocks him from achieving his goals
FORCE,We are stuck on this problem.
FORCE,I am drowning in work.
FORCE,I am tied up with work.
FORCE,He is up to his neck in work.
FORCE,"...allow courts to circumvent the First Amendment, slowly eroding the freedom of the press in a much more subtle manner than if they gagged the media directly."
FORCE,The government should not muzzle the press.
FORCE,Our project has hit a roadblock.
FORCE,What's holding you back from pursuing your dreams?
FORCE,They faced some tough problems at the beginning of their marriage but got over them quickly.
FORCE,We have a lot of hurdles to get over in our relationship.
FORCE,Recently enacted policies provide cover for companies engaged in illicit activities.
FORCE,My life is going nowhere - I'm just spinning my wheels.
FORCE,Break out of your daily routine.
FORCE,Workers of the world throw off your chains!
FORCE,All these rules and regulations are obstacles to innovation.
FORCE,saddle the American people with gun control
FORCE,gun control trap
FORCE,Senate Republicans blocked legislation Wednesday that would have established a billion jobs program putting veterans back to work tending to the country's federal lands and bolstering local police and fire departments.
FORCE,This mini-controversy erupted when Republicans introduced a string of amendments in a final effort to obstruct passage of the reconciliation bill.
FORCE,"Though politically the country is free, its people remain chained by poverty."
FORCE,House Republicans blocked the Democrats' attempts to move forward with the healthcare bill.
FORCE,The Senator's filibuster halted the passage of the bill.
FORCE,Our relationship is losing steam.
FORCE,He pushes me too hard.
FORCE,She pushed me into doing it.
FORCE,They dragged me into doing it.
FORCE,I am being pulled along by the current.
FORCE,She leaned on him to do it.
FORCE,She put the lean on him.
FORCE,He is a mover and a shaker.
FORCE,He really throws his weight around.
FORCE,"Bloomberg Goes to Washington to Push Gun Laws, but Senate Has Other Ideas"
FORCE,Livingston County judge: Cuomo administration steamrolled lawmakers on gay marriage vote
FORCE,Vanity finally drove me to have the operation.
FORCE,He turned all funny.
FORCE,He turned into a monster.
FORCE,"There was a remarkable turn-round from an $ 828,000 loss to a $ 175,000 surplus."
FORCE,She has gone mad over him.
FORCE,The friendship turned sour last summer.
FORCE,My father became fierce when he lost his temper.
FORCE,He was growing anxious for her being again at Mansfield.
FORCE,It is smooth sailing from here on in.
FORCE,It's all downhill from here.
FORCE,There's nothing in our way.
FORCE,She guided him through it.
FORCE,She walked him through it.
FORCE,She led him through the rough parts.
FORCE,I am proud of the momentum towards Fair Trade that now exists.
FORCE,the Lisbon strategy is going to have new momentum.
FORCE,It is now time ... because the momentum is there.
FORCE,Last November saw the peace process gather momentum.
FORCE,Economic growth has gained momentum.
FORCE,I think some momentum is being lost.
FORCE,This momentum is diminishing day by day.
FORCE,"On the contrary, it created new momentum."
FORCE,We urgently need a European policy to give momentum to this sector.
FORCE,Now the time has come to regenerate a new momentum in the reform process.
FORCE,Appointing people who are even worse than NN ... will destroy the momentum and work against progress.
FORCE,The report comes at the right moment to maintain the momentum for the in-depth revision of the Directive.
FORCE,Europe must now keep the momentum going.
FORCE,We are not convinced at this stage that such an initiative would indeed boost momentum in the region.
FORCE,The new government is encouraged to consolidate and enhance the momentum of political reform.
FORCE,"I, too, am in favour of an evaluation and of our now putting to the test /…/, but we also need new momentum"
FORCE,"But this requires reform, it requires economic momentum, and it requires higher rates of productivity."
FORCE,I believe we should take advantage of the momentum generated by the Transatlantic Agenda.
FORCE,I hope that we can use this momentum together for the benefit of effective European solidarity.
FORCE,This momentum causes an increasing number of delegations to realise that it is more in their interests for the talks to succeed than to fail.
FORCE,We are going upstream.
FORCE,We are fighting an uphill battle.
FORCE,It’s a steep road ahead.
FORCE,It’s a long and winding road.
FORCE,We are in rough waters.
FORCE,This computer program turns the power on and off.
FORCE,"Create a complete, measurable, action plan which includes all the steps necessary to achieve your goal."
FORCE,We're skipping right along.
FORCE,I'm walking on egg shells.
FORCE,We slogged through it.
FORCE,The state took a big step toward banning assault weapons.
FORCE,Congress moved quickly to avoid a governmental shutdown.
FORCE,The legislature is considering an alternative approach to deficit reduction.
FORCE,Postal Service bill faces roadblocks
FORCE,Scientists have taken a big step in understanding Alzheimer’s disease.
FORCE,We’ve taken the first step.
FORCE,I’m moving right along on the project.
FORCE,She made great strides in her dissertation.
FORCE,She climbed out of poverty.
FORCE,We are trying to find the most elegant approach to solving this problem.
FORCE,We’ve come a long way.
FORCE,We’ve covered lots of ground.
FORCE,We’ve made it this far.
FORCE,Oil shares continued to move ahead …
FORCE,XYZ-Aktien rückten vor.
FORCE,The Service will continue to stagger from crisis to crisis.
FORCE,We are moving ahead.
FORCE,Let’s forge ahead.
FORCE,Let’s keep moving forward.
FORCE,We made lots of forward movement.
FORCE,We are sliding backward.
FORCE,We are backsliding.
FORCE,We need to backtrack.
FORCE,It is time to turn around and retrace our steps.
FORCE,We are at a standstill.
FORCE,We aren’t getting anyplace.
FORCE,We are going nowhere with this.
FORCE,He hadn't made much headway in writing the termpaper.
FORCE,I'm afraid I haven't gotten very far in grading the exams.
FORCE,In London sind die Kurse … zurückgegangen.
FORCE,The market eased back from its recent advance.
FORCE,The province is quite close to sliding into civil war.
FORCE,I came out of my depression.
FORCE,He went crazy.
FORCE,He went over the edge.
FORCE,She entered a state of euphoria.
FORCE,He fell into a depression.
FORCE,He went deeper into his depression.
FORCE,"In the sun, the clothes went from wet to dry in an hour."
FORCE,"In the sun, the clothes went from wet to dry in an hour."
FORCE,He went from innocent to worldly.
FORCE,She was nearly insane.
FORCE,He slipped into a depression.
FORCE,His hair went gray.
FORCE,He went from laughing to crying.
FORCE,She was nearly crying.
FORCE,He went back to/returned to polishing the silver.
FORCE,My car has gone from bad to worse lately.
FORCE,I got a headache.
FORCE,My headache went away.
FORCE,The noise gave me a headache.
FORCE,The aspirin took away my headache.
FORCE,The council brought the project into compliance with state regulations.
FORCE,This book will guide you step by step how to apply for citizenship.
FORCE,cash flow
FORCE,The money is gushing out of my retirement account.
FORCE,He can exert his influence on her.
FORCE,Her influence was strong.
FORCE,She could bend his will.
FORCE,Reagan brought pressure to bear upon his cabinet.
FORCE,I was moved by the poem.
FORCE,I was pushed into depression.
FORCE,She was carried away by the song.
FORCE,He was struck by anger.
FORCE,I was moved by the poem.
FORCE,I can feel the good vibrations.
FORCE,I can feel the good vibrations.
FORCE,felt a sudden restlessness like that of a ship pulling against its moorings.
FORCE,"expressed in multiple movements, wasted, unnecessary, like the tu- mult of wind or water"
FORCE,making for tumult and motion
FORCE,"But inevitably, she would grow restive and tumultuous, chaotic and disturbed."
FORCE,"The same irresistible impulse, tension, compulsion and then depression following the yielding to the impulse, revulsion, bitterness, depression, and the compulsion once more."
FORCE,All the tensions of pretences ceased.
FORCE,and not a chaos which carried her.
FORCE,her own nerves did not coil and spring within her
FORCE,"The wild compass whose fluctuations she had always obeyed, making for tumult and motion in place of direction, was suddenly fractured."
FORCE,add heavily to the weights pulling her downward
FORCE,she carried too great a weight of untold stories
FORCE,her mood of weight and fatigue.
FORCE,At the same time a strange wave of anger appeared which she felt and could not understand.
FORCE,"But inevitably, she would grow restive and tumultuous, chaotic and disturbed"
FORCE,"The wild compass whose fluctuations she had always obeyed, making for tumult and motion in place of direction, was suddenly fractured so that she no longer knew even the re- lief of ebbs and flows and dispersions."
FORCE,Anxiety had entered her body and refused to run through it.
FORCE,"The silvery holes of her sieve against sorrow granted her at birth, had clogged."
FORCE,It was a stormy meeting.
FORCE,climate of anger
FORCE,flood of anger
FORCE,surge of anger
FORCE,wave of anger
FORCE,anger surge
FORCE,anger roil in(side) of someone
FORCE,anger sweeps him beyond emotion
FORCE,anger washes over her
FORCE,anger washes through him
FORCE,anger subsides away
FORCE,anger ebbs away
FORCE,let anger unroll like a wave
FORCE,staunches anger
FORCE,haven from anger
FORCE,She was engulfed by panic
FORCE,wave of fear
FORCE,He was swept off his feet
FORCE,flood of joy
FORCE,surge of joy
FORCE,joy surges through them
FORCE,joy sweeps over her
FORCE,joy sweeps through him
FORCE,to be swept away by joy
FORCE,joy subside
FORCE,She was overwhelmed with joy.
FORCE,We were carried away with happiness.
FORCE,He was swept off his feet.
FORCE,I was bowled over.
FORCE,They were transported.
FORCE,That was a terrible blow.
FORCE,Waves of depression came over him.
FORCE,rushes of sadness
FORCE,waves of sadness
FORCE,sadness sweeps over her
FORCE,sadness washes over them
FORCE,They were drawn to each other.
FORCE,He found the brussel sprouts repulsive.
FORCE,Tom Hanks is very attractive.
FORCE,I was forced to do it.
FORCE,I could feel the electricity between us.
FORCE,There were sparks.
FORCE,I was magnetically drawn to her.
FORCE,They are uncontrollably attracted to each other.
FORCE,They gravitated to each other immediately.
FORCE,The atmosphere around them is always charged.
FORCE,There is incredible energy in their relationship.
FORCE,They lost their momentum.
FORCE,She knocked me out.
FORCE,I was bowled over by him.
FORCE,We were immediately attracted to each other.
FORCE,There was a magnetism between us.
FORCE,We were drawn to each other.
FORCE,He swept her off her feet.
FORCE,The hit sent the crowd into a frenzy.
FORCE,FDR’s leadership brought the country out of the depression.
FORCE,The home run threw the crowd into a frenzy.
FORCE,The home run threw the crowd into a frenzy.
FORCE,Their negotiations pulled both sides from the brink of war.
FORCE,That experience pushed him over the edge.
FORCE,Her speech moved the crowd to rage.
FORCE,The news propelled the stock market to record heights.
FORCE,The trial thrust O.J.’s attorneys into the limelight.
FORCE,We’ve accelerated the building of the new bridge.
FORCE,They pushed the bill through Congress.
FORCE,California Cities Struggling Under Wave of Corruption
FORCE,FIFA facing corruption 'tsunami'
LINK,There’s strong bond between them.
LINK,having connections
LINK,breaking social ties
LINK,the bonds of slavery
OBJECT,Seize the opportunity.
OBJECT,Don’t lose this opportunity.
OBJECT,Don’t let the opportunity pass you by.
OBJECT,You have to make your own opportunities.
OBJECT,I’ve had 3 opportunities to meet him.
OBJECT,You rarely find that kind of opportunity.
OBJECT,We've got plenty of chances left.
OBJECT,I've squandered every opportunity to advance my career.
OBJECT,I want control over my own existence.
OBJECT,The dodo disappeared in the 1600s.
OBJECT,Sally gave the idea to Sam.
OBJECT,Sally took the idea from Sam.
OBJECT,Sally traded ideas with Sam.
OBJECT,Sally sold the idea to the highest bidder.
OBJECT,IBM bought the idea from him.
OBJECT,Sally has an idea.
OBJECT,Sally put the idea aside.
OBJECT,Sally threw the idea at Sam.
OBJECT,Sally lost her idea.
OBJECT,Sally found an idea in the book.
OBJECT,Sally carries that idea around with her all the time.
OBJECT,Sally searched for an idea all day.
OBJECT,It`s difficult to put my ideas into words.
OBJECT,What’s the matter?
OBJECT,"The distribution of sex cells, however, was a different matter."
OBJECT,It is difficult for unilateralists to admit there is another side to the missile question.
OBJECT,That is a very hard question to answer.
OBJECT,It’s a tough problem.
OBJECT,Let us turn to less weighty matters.
OBJECT,You'd need an electron microscope to find the point of this essay.
OBJECT,The meaning is right there in the words.
OBJECT,His words carry little meaning.
OBJECT,Don’t force your meaning into the wrong words.
OBJECT,The sentence is without meaning.
OBJECT,Don't waste your time.
OBJECT,Our time is valuable.
OBJECT,We don't have much time.
OBJECT,Stars whose careers collapsed in a relatively short amount of time
OBJECT,How to make a career out of things you would do even for free.
OBJECT,The noise is giving me a headache.
OBJECT,"Again, if by any chance, we should ultimately win out in such a war, what would it cost us in treasure and in blood?"
OBJECT,Let's toss some ideas around.
OBJECT,He just can't seem to grasp the concept.
OBJECT,He got a good handle on the subject matter.
OBJECT,The oil spill has caused a shock to the environment.
OBJECT,Smog pollution is an environmental malaise.
OBJECT,Ecologists are nursing the Bay back to health.
OBJECT,She has a nice sense of humor.
OBJECT,He lost his tolerance for alcohol.
OBJECT,She gained a new equanimity.
OBJECT,He got his red hair from his mother.
OBJECT,He gave his son a sense of self-worth.
OBJECT,He gives his art a certain integrity.
OBJECT,Harry has trouble.
OBJECT,I have a headache.
OBJECT,She has a sunny disposition.
OBJECT,This place has lost a lot of its charm.
OBJECT,The new mustache gave him an older appearance.
OBJECT,"The dummies were 2-to-1 in favor of the Arizona immigration law; the court gutted it. Only those dummies, not in a state of denial, understand that we the people have lost control of our government."
